text_clean,label
"salle sport très propre coachs très serviables. serviettes bouteilles eau volonté fournies, tout impeccable. bien nombre équipements ne pas comparable celui autres pays, coachs toujours disponibles aideront adapter exercices, rendre plus difficiles plus adaptés. haltères jusqu 36 kg. salle musculation peu fréquentée clientèle accueillante. semble avoir autres installations comme piscine sauna, ne jamais utilisés. ensemble, recommande, surtout si séjournez proximité. prix lors séjour 90 ntd environ 30 pass journée, 270 ntd environ 90 pass deux semaines 450 ntd environ 150 pass mensuel. prix peu excessifs, peu cas.",2
salle trop petite.cout trop élevé nombre qualité machines.toujours remplie.,0
"excellent endroit, membres très polis respectueux, capitaines, particulier capitaine osama, succursale tunisia mall, très propres, excellent.",2
"expérience exceptionnelle salle sport 7 étoiles _exclamation_ récemment inscrit california gym platinum tout simplement incroyable _exclamation_ établissement haut gamme, large gamme équipements haute qualité, idéal atteindre tous objectifs fitness. si ne trouverez pas toutes machines disponibles autres salles sport, expérience globale compense largement. service excellent, personnel aimable professionnel toujours prêt aider. atout majeur : luxueux spa jacuzzi, où pourrez détendre après séance entraînement. salle sport met disposition serviettes, peignoirs bouteilles eau volonté, confort tout moment. piscine fantastique, propreté hygiène salle irréprochables. espace premium, reflète prix : peu élevé, peut donc ne pas convenir tout monde. cependant, si recherchez expérience sport haut gamme, california gym platinum endroit idéal. excellents entraîneurs cours dynamiques passant espace spa relaxant, cette salle sport a tout plaire. fortement recommandée ceux apprécient qualité prêts investir parcours remise forme. résumé, expérience 7 étoiles parfaite _exclamation_",2
cet endroit très fréquenté,2
club très distingué,2
"tout personnel super sympa, taoufik meilleur. entraîne coachs asie, amérique europe, loin meilleur _exclamation_ recommande cette salle tous, tunisiens comme étrangers, car sentirez bien pourrez atteindre objectifs. recommande chaudement.",2
one of the worst management and customer service.,0
"california gym décevant plusieurs raisons. 1 salle petite bondée, rend entraînement inconfortable. 2 plusieurs machines panne, semble avoir aucune maintenance régulière. 3 mauvaise expérience nutritionniste, ne respecte pas rendez adopte attitude très désagréable clients.",0
"magnifique a tout nécessaire, sauf vestibule, pas très propre étroit. ne pas aise changer.",2
super,2
"cadre agréable, personnel sympathique professionnalisme irréprochable. hygiène irréprochable",2
super salle sport cours collectifs top,2
grand espace très agréable lumineux surtout côté tapis,2
piscine enfants,2
bien,2
matériels manquants trop cher mauvaise clientèle mauvaise gestion,0
personnel gentil grande salle,2
impeccable salle bien gérée toujours top propreté matériel qualité très très bien entretenu personnel exemplaire accueil responsables information notamment armée nettoyage abonné cgym depuis 2019 salle zéphyr 200 mètres chez depuis ouverture must merci cgym exister loisirs santé,2
"a personnel serviable, bon équipement incroyablement cher.",2
"endroit tel état sidéré. a fuite toit espace musculation, salle sport clairement moins propre entretenue autres salles sport californiennes, alors gens paient prix _exclamation_ vraiment inadmissible _exclamation_ a peine place déplacer sent tout suite étroit. quelle déception _exclamation_",0
meilleurs salles,2
excellent endroit,2
"très bon endroit évacuer stress coachs super très bonne ambiance, recommande totalement",2
excellent cadre,2
"équipe négligente exception quelques personnes, toujours bon endroit entraîner si mettez cela côté",1
